<?xml version="1.0" encoding="UTF-8"?>
<dataroot xmlns:od="urn:schemas-microsoft-com:officedata" xmlns:xsi="http://www.w3.org/2001/XMLSchema-instance"  xsi:noNamespaceSchemaLocation="ASL_distinct.xsd" generated="2020-06-07T00:08:20">
<ASL_distinct>
<code>150206</code>
<ANNO>2020</ANNO>
<CODICE_x0020_REGIONE>150</CODICE_x0020_REGIONE>
<DENOMINAZIONE_x0020_REGIONE>CAMPANIA</DENOMINAZIONE_x0020_REGIONE>
<CODICE_x0020_AZIENDA>206</CODICE_x0020_AZIENDA>
<DENOMINAZIONE_x0020_AZIENDA>A.S.L. NAPOLI 3 SUD</DENOMINAZIONE_x0020_AZIENDA>
<INDIRIZZO>C.SO ALCIDE DE GASPERI 167</INDIRIZZO>
<CAP>80053</CAP>
<COMUNE>CASTELLAMMARE DI STABIA</COMUNE>
<SIGLA_x0020_PROVINCIA>NA</SIGLA_x0020_PROVINCIA>
<stato>active</stato>
</ASL_distinct>
<ASL_distinct>
<code>180203</code>
<ANNO>2020</ANNO>
<CODICE_x0020_REGIONE>180</CODICE_x0020_REGIONE>
<DENOMINAZIONE_x0020_REGIONE>CALABRIA</DENOMINAZIONE_x0020_REGIONE>
<CODICE_x0020_AZIENDA>203</CODICE_x0020_AZIENDA>
<DENOMINAZIONE_x0020_AZIENDA>A.S.P. CATANZARO</DENOMINAZIONE_x0020_AZIENDA>
<INDIRIZZO>VIA VINICIO CORTESE 25</INDIRIZZO>
<CAP>88100</CAP>
<COMUNE>CATANZARO</COMUNE>
<SIGLA_x0020_PROVINCIA>CZ</SIGLA_x0020_PROVINCIA>
<stato>active</stato>
</ASL_distinct>
<ASL_distinct>
<code>150205</code>
<ANNO>2020</ANNO>
<CODICE_x0020_REGIONE>150</CODICE_x0020_REGIONE>
<DENOMINAZIONE_x0020_REGIONE>CAMPANIA</DENOMINAZIONE_x0020_REGIONE>
<CODICE_x0020_AZIENDA>205</CODICE_x0020_AZIENDA>
<DENOMINAZIONE_x0020_AZIENDA>A.S.L. NAPOLI 2 NORD</DENOMINAZIONE_x0020_AZIENDA>
<INDIRIZZO>VIA CORRADO ALVARO 8</INDIRIZZO>
<CAP>80078</CAP>
<COMUNE>POZZUOLI</COMUNE>
<SIGLA_x0020_PROVINCIA>NA</SIGLA_x0020_PROVINCIA>
<stato>active</stato>
</ASL_distinct>
<ASL_distinct>
<code>180205</code>
<ANNO>2020</ANNO>
<CODICE_x0020_REGIONE>180</CODICE_x0020_REGIONE>
<DENOMINAZIONE_x0020_REGIONE>CALABRIA</DENOMINAZIONE_x0020_REGIONE>
<CODICE_x0020_AZIENDA>205</CODICE_x0020_AZIENDA>
<DENOMINAZIONE_x0020_AZIENDA>A.S.P. REGGIO CALABRIA</DENOMINAZIONE_x0020_AZIENDA>
<INDIRIZZO>VIA SANT&apos;ANNA II TRONCO 18/P</INDIRIZZO>
<CAP>89128</CAP>
<COMUNE>REGGIO DI CALABRIA</COMUNE>
<SIGLA_x0020_PROVINCIA>RC</SIGLA_x0020_PROVINCIA>
<stato>active</stato>
</ASL_distinct>
<ASL_distinct>
<code>190201</code>
<ANNO>2020</ANNO>
<CODICE_x0020_REGIONE>190</CODICE_x0020_REGIONE>
<DENOMINAZIONE_x0020_REGIONE>SICILIA</DENOMINAZIONE_x0020_REGIONE>
<CODICE_x0020_AZIENDA>201</CODICE_x0020_AZIENDA>
<DENOMINAZIONE_x0020_AZIENDA>ASP AGRIGENTO</DENOMINAZIONE_x0020_AZIENDA>
<INDIRIZZO>VIA MANZONI  140</INDIRIZZO>
<CAP>92100</CAP>
<COMUNE>AGRIGENTO</COMUNE>
<SIGLA_x0020_PROVINCIA>AG</SIGLA_x0020_PROVINCIA>
<stato>active</stato>
</ASL_distinct>
<ASL_distinct>
<code>190202</code>
<ANNO>2020</ANNO>
<CODICE_x0020_REGIONE>190</CODICE_x0020_REGIONE>
<DENOMINAZIONE_x0020_REGIONE>SICILIA</DENOMINAZIONE_x0020_REGIONE>
<CODICE_x0020_AZIENDA>202</CODICE_x0020_AZIENDA>
<DENOMINAZIONE_x0020_AZIENDA>ASP CALTANISSETTA</DENOMINAZIONE_x0020_AZIENDA>
<INDIRIZZO>VIA CUSMANO 10</INDIRIZZO>
<CAP>93100</CAP>
<COMUNE>CALTANISSETTA</COMUNE>
<SIGLA_x0020_PROVINCIA>CL</SIGLA_x0020_PROVINCIA>
<stato>active</stato>
</ASL_distinct>
<ASL_distinct>
<code>190203</code>
<ANNO>2020</ANNO>
<CODICE_x0020_REGIONE>190</CODICE_x0020_REGIONE>
<DENOMINAZIONE_x0020_REGIONE>SICILIA</DENOMINAZIONE_x0020_REGIONE>
<CODICE_x0020_AZIENDA>203</CODICE_x0020_AZIENDA>
<DENOMINAZIONE_x0020_AZIENDA>ASP CATANIA</DENOMINAZIONE_x0020_AZIENDA>
<INDIRIZZO>VIA S. MARIA LA GRANDE 5</INDIRIZZO>
<CAP>95124</CAP>
<COMUNE>CATANIA</COMUNE>
<SIGLA_x0020_PROVINCIA>CT</SIGLA_x0020_PROVINCIA>
<stato>active</stato>
</ASL_distinct>
<ASL_distinct>
<code>190204</code>
<ANNO>2020</ANNO>
<CODICE_x0020_REGIONE>190</CODICE_x0020_REGIONE>
<DENOMINAZIONE_x0020_REGIONE>SICILIA</DENOMINAZIONE_x0020_REGIONE>
<CODICE_x0020_AZIENDA>204</CODICE_x0020_AZIENDA>
<DENOMINAZIONE_x0020_AZIENDA>ASP ENNA</DENOMINAZIONE_x0020_AZIENDA>
<INDIRIZZO>VIALE DIAZ 23</INDIRIZZO>
<CAP>94100</CAP>
<COMUNE>ENNA</COMUNE>
<SIGLA_x0020_PROVINCIA>EN</SIGLA_x0020_PROVINCIA>
<stato>active</stato>
</ASL_distinct>
<ASL_distinct>
<code>190205</code>
<ANNO>2020</ANNO>
<CODICE_x0020_REGIONE>190</CODICE_x0020_REGIONE>
<DENOMINAZIONE_x0020_REGIONE>SICILIA</DENOMINAZIONE_x0020_REGIONE>
<CODICE_x0020_AZIENDA>205</CODICE_x0020_AZIENDA>
<DENOMINAZIONE_x0020_AZIENDA>ASP MESSINA</DENOMINAZIONE_x0020_AZIENDA>
<INDIRIZZO>VIA DEL VESPRO  289</INDIRIZZO>
<CAP>98100</CAP>
<COMUNE>MESSINA</COMUNE>
<SIGLA_x0020_PROVINCIA>ME</SIGLA_x0020_PROVINCIA>
<stato>active</stato>
</ASL_distinct>
<ASL_distinct>
<code>190206</code>
<ANNO>2020</ANNO>
<CODICE_x0020_REGIONE>190</CODICE_x0020_REGIONE>
<DENOMINAZIONE_x0020_REGIONE>SICILIA</DENOMINAZIONE_x0020_REGIONE>
<CODICE_x0020_AZIENDA>206</CODICE_x0020_AZIENDA>
<DENOMINAZIONE_x0020_AZIENDA>ASP PALERMO</DENOMINAZIONE_x0020_AZIENDA>
<INDIRIZZO>VIA G. CUSMANO 24</INDIRIZZO>
<CAP>90100</CAP>
<COMUNE>PALERMO</COMUNE>
<SIGLA_x0020_PROVINCIA>PA</SIGLA_x0020_PROVINCIA>
<stato>active</stato>
</ASL_distinct>
<ASL_distinct>
<code>190207</code>
<ANNO>2020</ANNO>
<CODICE_x0020_REGIONE>190</CODICE_x0020_REGIONE>
<DENOMINAZIONE_x0020_REGIONE>SICILIA</DENOMINAZIONE_x0020_REGIONE>
<CODICE_x0020_AZIENDA>207</CODICE_x0020_AZIENDA>
<DENOMINAZIONE_x0020_AZIENDA>ASP RAGUSA</DENOMINAZIONE_x0020_AZIENDA>
<INDIRIZZO>P.ZZA IGEA 1</INDIRIZZO>
<CAP>97100</CAP>
<COMUNE>RAGUSA</COMUNE>
<SIGLA_x0020_PROVINCIA>RG</SIGLA_x0020_PROVINCIA>
<stato>active</stato>
</ASL_distinct>
<ASL_distinct>
<code>190208</code>
<ANNO>2020</ANNO>
<CODICE_x0020_REGIONE>190</CODICE_x0020_REGIONE>
<DENOMINAZIONE_x0020_REGIONE>SICILIA</DENOMINAZIONE_x0020_REGIONE>
<CODICE_x0020_AZIENDA>208</CODICE_x0020_AZIENDA>
<DENOMINAZIONE_x0020_AZIENDA>ASP SIRACUSA</DENOMINAZIONE_x0020_AZIENDA>
<INDIRIZZO>C.SO GELONE 17</INDIRIZZO>
<CAP>96100</CAP>
<COMUNE>SIRACUSA</COMUNE>
<SIGLA_x0020_PROVINCIA>SR</SIGLA_x0020_PROVINCIA>
<stato>active</stato>
</ASL_distinct>
<ASL_distinct>
<code>190209</code>
<ANNO>2020</ANNO>
<CODICE_x0020_REGIONE>190</CODICE_x0020_REGIONE>
<DENOMINAZIONE_x0020_REGIONE>SICILIA</DENOMINAZIONE_x0020_REGIONE>
<CODICE_x0020_AZIENDA>209</CODICE_x0020_AZIENDA>
<DENOMINAZIONE_x0020_AZIENDA>ASP DI TRAPANI</DENOMINAZIONE_x0020_AZIENDA>
<INDIRIZZO>VIA MAZZINI 1</INDIRIZZO>
<CAP>91100</CAP>
<COMUNE>TRAPANI</COMUNE>
<SIGLA_x0020_PROVINCIA>TP</SIGLA_x0020_PROVINCIA>
<stato>active</stato>
</ASL_distinct>
<ASL_distinct>
<code>180202</code>
<ANNO>2020</ANNO>
<CODICE_x0020_REGIONE>180</CODICE_x0020_REGIONE>
<DENOMINAZIONE_x0020_REGIONE>CALABRIA</DENOMINAZIONE_x0020_REGIONE>
<CODICE_x0020_AZIENDA>202</CODICE_x0020_AZIENDA>
<DENOMINAZIONE_x0020_AZIENDA>A.S.P. CROTONE</DENOMINAZIONE_x0020_AZIENDA>
<INDIRIZZO>VIA CORIGLIANO 1</INDIRIZZO>
<CAP>88900</CAP>
<COMUNE>CROTONE</COMUNE>
<SIGLA_x0020_PROVINCIA>KR</SIGLA_x0020_PROVINCIA>
<stato>active</stato>
</ASL_distinct>
<ASL_distinct>
<code>120205</code>
<ANNO>2020</ANNO>
<CODICE_x0020_REGIONE>120</CODICE_x0020_REGIONE>
<DENOMINAZIONE_x0020_REGIONE>LAZIO</DENOMINAZIONE_x0020_REGIONE>
<CODICE_x0020_AZIENDA>205</CODICE_x0020_AZIENDA>
<DENOMINAZIONE_x0020_AZIENDA>ROMA 5</DENOMINAZIONE_x0020_AZIENDA>
<INDIRIZZO>VIA TIBURTINA 22/A</INDIRIZZO>
<CAP>00019</CAP>
<COMUNE>TIVOLI</COMUNE>
<SIGLA_x0020_PROVINCIA>RM</SIGLA_x0020_PROVINCIA>
<stato>active</stato>
</ASL_distinct>
<ASL_distinct>
<code>200201</code>
<ANNO>2020</ANNO>
<CODICE_x0020_REGIONE>200</CODICE_x0020_REGIONE>
<DENOMINAZIONE_x0020_REGIONE>SARDEGNA</DENOMINAZIONE_x0020_REGIONE>
<CODICE_x0020_AZIENDA>201</CODICE_x0020_AZIENDA>
<DENOMINAZIONE_x0020_AZIENDA>AZIENDA PER LA TUTELA DELLA SALUTE</DENOMINAZIONE_x0020_AZIENDA>
<INDIRIZZO>VIA MONTE GRAPPA 82</INDIRIZZO>
<CAP>07100</CAP>
<COMUNE>SASSARI</COMUNE>
<SIGLA_x0020_PROVINCIA>SS</SIGLA_x0020_PROVINCIA>
<stato>active</stato>
</ASL_distinct>
<ASL_distinct>
<code>100201</code>
<ANNO>2020</ANNO>
<CODICE_x0020_REGIONE>100</CODICE_x0020_REGIONE>
<DENOMINAZIONE_x0020_REGIONE>UMBRIA</DENOMINAZIONE_x0020_REGIONE>
<CODICE_x0020_AZIENDA>201</CODICE_x0020_AZIENDA>
<DENOMINAZIONE_x0020_AZIENDA>AUSL UMBRIA N. 1</DENOMINAZIONE_x0020_AZIENDA>
<INDIRIZZO>VIA G. GUERRA  21/17</INDIRIZZO>
<CAP>06127</CAP>
<COMUNE>PERUGIA</COMUNE>
<SIGLA_x0020_PROVINCIA>PG</SIGLA_x0020_PROVINCIA>
<stato>active</stato>
</ASL_distinct>
<ASL_distinct>
<code>100202</code>
<ANNO>2020</ANNO>
<CODICE_x0020_REGIONE>100</CODICE_x0020_REGIONE>
<DENOMINAZIONE_x0020_REGIONE>UMBRIA</DENOMINAZIONE_x0020_REGIONE>
<CODICE_x0020_AZIENDA>202</CODICE_x0020_AZIENDA>
<DENOMINAZIONE_x0020_AZIENDA>AUSL UMBRIA N. 2</DENOMINAZIONE_x0020_AZIENDA>
<INDIRIZZO>VIALE BRAMANTE  37</INDIRIZZO>
<CAP>05100</CAP>
<COMUNE>TERNI</COMUNE>
<SIGLA_x0020_PROVINCIA>TR</SIGLA_x0020_PROVINCIA>
<stato>active</stato>
</ASL_distinct>
<ASL_distinct>
<code>110201</code>
<ANNO>2020</ANNO>
<CODICE_x0020_REGIONE>110</CODICE_x0020_REGIONE>
<DENOMINAZIONE_x0020_REGIONE>MARCHE</DENOMINAZIONE_x0020_REGIONE>
<CODICE_x0020_AZIENDA>201</CODICE_x0020_AZIENDA>
<DENOMINAZIONE_x0020_AZIENDA>ASUR</DENOMINAZIONE_x0020_AZIENDA>
<INDIRIZZO>Via G. Oberdan 2</INDIRIZZO>
<CAP>60122</CAP>
<COMUNE>ANCONA</COMUNE>
<SIGLA_x0020_PROVINCIA>AN</SIGLA_x0020_PROVINCIA>
<stato>active</stato>
</ASL_distinct>
<ASL_distinct>
<code>120109</code>
<ANNO>2020</ANNO>
<CODICE_x0020_REGIONE>120</CODICE_x0020_REGIONE>
<DENOMINAZIONE_x0020_REGIONE>LAZIO</DENOMINAZIONE_x0020_REGIONE>
<CODICE_x0020_AZIENDA>109</CODICE_x0020_AZIENDA>
<DENOMINAZIONE_x0020_AZIENDA>VITERBO</DENOMINAZIONE_x0020_AZIENDA>
<INDIRIZZO>VIA ENRICO FERMI 15</INDIRIZZO>
<CAP>01100</CAP>
<COMUNE>VITERBO</COMUNE>
<SIGLA_x0020_PROVINCIA>VT</SIGLA_x0020_PROVINCIA>
<stato>active</stato>
</ASL_distinct>
<ASL_distinct>
<code>120110</code>
<ANNO>2020</ANNO>
<CODICE_x0020_REGIONE>120</CODICE_x0020_REGIONE>
<DENOMINAZIONE_x0020_REGIONE>LAZIO</DENOMINAZIONE_x0020_REGIONE>
<CODICE_x0020_AZIENDA>110</CODICE_x0020_AZIENDA>
<DENOMINAZIONE_x0020_AZIENDA>RIETI</DENOMINAZIONE_x0020_AZIENDA>
<INDIRIZZO>VIALE  MATTEUCCI 9</INDIRIZZO>
<CAP>02100</CAP>
<COMUNE>RIETI</COMUNE>
<SIGLA_x0020_PROVINCIA>RI</SIGLA_x0020_PROVINCIA>
<stato>active</stato>